{
  "$schema": "https://swornagent.dev/schemas/s19-executable-proof-contract-amendment-v1.json",
  "record_version": 1,
  "amendment_id": "s19-executable-proof-contract-20260717",
  "release": "2026-07-15-baton-v0.15-conformance",
  "slice_id": "S19-s02-v015-rollback",
  "authority": "planner",
  "source": {
    "blocked_verdict_commit": "d6bfd4578d367aa6bac2ed3243a6f2c909c183ce",
    "track_ref": "track/2026-07-15-baton-v0.15-conformance/T1-foundation",
    "track_head": "d6bfd4578d367aa6bac2ed3243a6f2c909c183ce",
    "status_path": "docs/release/2026-07-15-baton-v0.15-conformance/S19-s02-v015-rollback/status.json",
    "status_blob_oid": "7cabfb67504458dc2f6f92fc966c2d84b7bfd8f3",
    "verification_result": "blocked",
    "gate": "Gate 4b - semantic coverage"
  },
  "baseline": {
    "s19_start_commit": "640396fa8cc319229d6f96dedfdbef65dbe317fe",
    "implementation_head": "4b38887e666f7e4ab664bac4780535b080ad54eb",
    "s02_start_commit": "e61cb190736ee7483fb4ed1a993442b26ce3574c",
    "s02_start_tree": "c57285e3f652e5f49aa8bb15e3ba65249b4a3db8",
    "frozen_s02_head": "2a17443d67d39cf681dba117a57673714a916d7f"
  },
  "allowed_post_start_spec_transition": {
    "path": "docs/release/2026-07-15-baton-v0.15-conformance/S19-s02-v015-rollback/spec.json",
    "before_blob_oid": "1e2f7a3ee70164320fa7dd30d6aba749fc5de47d",
    "after_blob_oid": "ae05d118cbb0eb47c6ad7595c25f93df5c14417e",
    "allowed_transition_count": 1,
    "evidence_path": "docs/release/2026-07-15-baton-v0.15-conformance/S19-s02-v015-rollback/proof/contract-amendment.json",
    "evidence_schema_path": "docs/release/2026-07-15-baton-v0.15-conformance/S19-s02-v015-rollback/proof/contract-amendment-v1.schema.json"
  },
  "allowed_rendered_index_validation": {
    "trigger": {
      "blocked_track_head": "07c8d65d50e0400c8efa1cac61947d0aca215a08",
      "blocked_status_blob_oid": "9f618893f58ed1e47b6e09bee43ee83a6402d02b",
      "blocked_reason": "planner-ratified executable-proof contract completeness"
    },
    "correction_ratification": {
      "ratified_by": "Captain/Coach standing orchestration authority",
      "ratified_at": "2026-07-17T01:59:17+10:00",
      "decision_statement": "S19 deterministic rendered-index correction: permit index.md only when an isolated current-head board render byte-matches it; preserve c0/c7 blobs as audit-only and prohibit arbitrary index edits.",
      "decision_digest": "sha256:38dd7eb69ae0874a893881692bbe9ee372b06cdfa809b967ba3c78e88397cdee"
    },
    "correction_spec_transition": {
      "path": "docs/release/2026-07-15-baton-v0.15-conformance/S19-s02-v015-rollback/spec.json",
      "before_blob_oid": "ae05d118cbb0eb47c6ad7595c25f93df5c14417e",
      "after_blob_oid": "7b63aad583c15de2db189c63990cc909c1269f6b",
      "allowed_transition_count": 1,
      "pre_ratification_release_wt_head": "c0d7d672fe14090655fea7db3f5bf0e22dfd29f9",
      "required_planner_commit_subject": "docs(release): ratify S19 deterministic index render contract",
      "evidence_path": "docs/release/2026-07-15-baton-v0.15-conformance/S19-s02-v015-rollback/proof/contract-amendment.json",
      "evidence_schema_path": "docs/release/2026-07-15-baton-v0.15-conformance/S19-s02-v015-rollback/proof/contract-amendment-v1.schema.json"
    },
    "current_render_rule": {
      "index_path": "docs/release/2026-07-15-baton-v0.15-conformance/index.md",
      "worktree_kind": "disposable detached Git worktree",
      "checkout_target": "current T1 track HEAD",
      "render_command": "sworn render 2026-07-15-baton-v0.15-conformance <ephemeral-project-root>",
      "comparison": "byte-for-byte rendered index equals the current track HEAD committed index",
      "cleanup_required": true,
      "must_not_mutate_validated_checkout": true,
      "must_not_mutate_release_refs": true,
      "historical_blobs_are_audit_only": true,
      "rejection_rule": "Permit index.md only on the current-render comparison; reject arbitrary index bytes and every other non-S19/non-lifecycle release record."
    },
    "observed_lineage_audit": {
      "direct_c0_transition": {
        "parent_commit": "deb090fcef736ca2e61b2c2136283beec4743e45",
        "planner_commit": "c0d7d672fe14090655fea7db3f5bf0e22dfd29f9",
        "before_blob_oid": "8aeef3849541106b6cb5503daed1874b0fb4d31f",
        "after_blob_oid": "b3ba13ef1b9d958e67b035f662e39dd0175a82a7"
      },
      "propagated_c7_merge": {
        "merge_commit": "c7d56c10f62c5583b5aeb27fda5aa9c8de50b81d",
        "parent_one_commit": "d6bfd4578d367aa6bac2ed3243a6f2c909c183ce",
        "parent_one_blob_oid": "37b0d6ebb72445802eab1ab336e3b4f5b7a8e7d5",
        "parent_two_commit": "c0d7d672fe14090655fea7db3f5bf0e22dfd29f9",
        "parent_two_blob_oid": "b3ba13ef1b9d958e67b035f662e39dd0175a82a7",
        "after_blob_oid": "1614b35035b685d7d9d3f9451c98fa350a91033f"
      }
    }
  },
  "checker_repair": {
    "checker_path": "docs/release/2026-07-15-baton-v0.15-conformance/S19-s02-v015-rollback/proof/check-rollback.sh",
    "checker_blob_before_repair": "ba1ef2323418ffd9e019ef2602ec1a1149b743b1",
    "required_live_invocation": "docs/release/2026-07-15-baton-v0.15-conformance/S19-s02-v015-rollback/proof/check-rollback.sh --head 4b38887e666f7e4ab664bac4780535b080ad54eb --require-maintainability --require-proof-bundle",
    "required_fresh_verifier_invocation": "docs/release/2026-07-15-baton-v0.15-conformance/S19-s02-v015-rollback/proof/check-rollback.sh --head 4b38887e666f7e4ab664bac4780535b080ad54eb --require-fresh-verifier",
    "preserved_allowlist": [
      "docs/release/2026-07-15-baton-v0.15-conformance/S19-s02-v015-rollback/status.json",
      "docs/release/2026-07-15-baton-v0.15-conformance/S19-s02-v015-rollback/journal.md",
      "docs/release/2026-07-15-baton-v0.15-conformance/S19-s02-v015-rollback/proof.json",
      "docs/release/2026-07-15-baton-v0.15-conformance/S19-s02-v015-rollback/proof.md",
      "docs/release/2026-07-15-baton-v0.15-conformance/S19-s02-v015-rollback/proof/",
      "docs/release/2026-07-15-baton-v0.15-conformance/S19-s02-v015-rollback/reports/maintainability/"
    ],
    "required_history_rule": "Retain the original allowlist; admit only the original and correction S19 spec transitions when their exact declared blobs and provenance validate, and admit index.md only through the disposable current-head deterministic render comparison; reject arbitrary index bytes and every other post-start S19 spec blob, path, transition, provenance, or non-S19/non-lifecycle release record."
  },
  "fresh_verifier_protocol": {
    "run_from_live_t1_history": true,
    "adversarial_objects_disposable": true,
    "must_not_mutate_release_refs": true,
    "required_adversarial_cases": [
      "mode_or_blob_drift",
      "surviving_s02_added_path",
      "unrecognized_merge_or_parent_two_drift",
      "authored_merge_overlap",
      "unexpected_later_ordinary_authority",
      "absent_fresh_verifier_evidence",
      "arbitrary_index_render_drift"
    ]
  },
  "prohibitions": [
    "No persistent non-release test file, CI workflow, CI hook, source package, or harness may be added or relied on for S19 historical rollback proof.",
    "No S02 release record may be changed, and no arbitrary post-start S19 spec or rendered-index edit may be admitted.",
    "Disposable adversarial Git objects may not mutate a release ref or become a committed harness."
  ],
  "ratification": {
    "ratified_by": "Captain/Coach standing orchestration authority",
    "ratified_at": "2026-07-17T01:25:52+10:00",
    "pre_ratification_release_wt_ref": "release-wt/2026-07-15-baton-v0.15-conformance",
    "pre_ratification_release_wt_head": "deb090fcef736ca2e61b2c2136283beec4743e45",
    "required_planner_commit_subject": "docs(release): ratify S19 executable rollback proof contract",
    "decision_statement": "S19 executable rollback proof contract amendment: allow exactly the planner-ratified post-start spec blob that binds the committed checker as the sole integration proof; prohibit any persistent non-release CI harness.",
    "decision_digest": "sha256:0fe68cee70fd44f3336cdb9a16d4ec23bd361cb0dcc85eb114e45edcab4ddbed"
  }
}
